Year,Location,Latitude,Longitude,Observer or Authorising Officer,Annual Average Mean Temperature (°C),Interesting facts,Source,map text,,,
1820,,,,,,,,"The first temperature and wind observations made in the Malayan peninsula were by officers of the British East India Company. They left no record of rainfall, probably because they were using measuring instruments from their ships, which did not carry rain gauges. The EIC had an interest in studying the local weather to explore the viability of making a permanent settlement. After a settlement was established, doctors quickly took an interest in making weather observations,  concerned about the 'healthiness' of the region for European colonisation and linking good weather with good health (Ward, 1830).
<br/>
<strong>(Click on the location balloons for each year to find out more!)</strong>",,,
1820,"Government's Hill, Fort Canning",1.2944439999999999,103.84690000000001,"Military Staff Officer, EEIC",26.4°C,"In Singapore, the first coherent weather records we have were made under the governorship of William Farquhar at Government Hill. In some accounts, the EEIC Bengal Native Infantry officer Charles Edward Davies is credited with making the Singapore readings.","Charles Edward Davis
<br/>
Farquhar, W. (1827). Thermometrical and barometrical tables (pp. 585–586). Transactions of the Royal Asiatic Society of Great Britain and Ireland. (Call no.: RRARE 551.609595 FAR; Accession no.: B29032746K)
<br/>
Malayan Meteorological Service. (1950). Annual report of the Malayan Meteorological Service, 1949 (p. 5). 
<br/>
<a href=""https://biblioasia.nlb.gov.sg/vol-16/issue-2/jul-sep-2020/rain#fnref:10"">https://biblioasia.nlb.gov.sg/vol-16/issue-2/jul-sep-2020/rain#fnref:10</a>",,,,
1839,,,,,,,,"During the 1830s, local weather observations were printed for the public in the local press, though we are not sure by whom they were made or for what purpose. A clue from the Singapore Free Press and Mercantile Advertiser (5 March 1840) suggests that they may have been made by an interested amateur, rather than as part of military or medical research.",,,
1839,Ryan's Hill ,1.2817270000000001, 103.843448 ,"Joseph S. Travelli, Missionary",,"One such amateur was an American missionary, Joseph S. Travelli. He recorded Singapore's temperature and rainfall from the mission school where he worked, run by the American Board of Foreign Missions located at Ryan's Hill (now Bukit Pasoh).
",,,,,
1841,Singapore Magnetic Observatory,1.310111,103.868194,"Lieutenant Charles Elliot, EEIC",27.8°C,"Located along Kallang River, Elliot's observatory was described as small but well designed for making weather observations. Direct sunlight was prevented from reaching the meteorological instruments and the walls were 18 inches thick and painted white in order to reflect heat (Elliot, 1849). 
<br/>
The observatory was closed in 1845 due to the withdrawal of funds from London. The instruments were sent to India for re-use in the observatory in Bombay.","C. M. Elliot, Singapore Magnetic Observatory Yearbook","In the 1840s, a fantastic experiment took place. Guided by the British Association for the Advancement of Science (BAAS) and the Royal Society in London, a formal observatory was established in Singapore. Run by Lieutenant Charles Elliot, an EEIC officer, it was Singapore's first semi-permanent research station to investigate magnetism, astronomy and weather. The observatory was located along Kallang River.",,,
1841,Ryan's Hill ,1.2817270000000001, 103.843448 ,"Joseph S. Travelli, Missionary",26.7°C,,"J. S. Travelli (1843), American Journal Arts and of Science

",,,,
1864,,,,,,,,"After the observatory closed in 1845 and until the early 1860s, we don't know if any weather observations were still being made in Singapore.  But they had resumed by 1864. ",,,
1864,"Killiney Estate, River Valley Road",1.2961879999999999,103.837075,"J.D. Vaughan, Police magistrate",,"In the mid-1860s we start to see  weather records appear again, some made by professionals and some by semi-amateurs. Plantation owner Jonas Daniel Vaughan was the first and one of the most comprehensive observers of this period. In his early life, he had served in the Bengal Marines, before being posted to Singapore as Master Attendant and Marine Magistrate in 1856 (Gibson, 1960; Makepeace, 1921). After retirement, he started a plantation in the River Valley Road area (then known as the Killeny Estate) alongside his police duties.
<br/>
His observations (1863-6) were published in the Straits Settlements Government Gazette.",,,,,
1864,Mount Pleasant,1.3309800000000001,103.838948,"Arthur Knight, Audit Officer",,"Arthur Knight, Vaughan's neighbour, also made meteorological observations at his estate at Mount Pleasant in Toa Payoh (Irvine Rowell, 1885). This would have been an incredible long series of observations spanning 17 years if all the information survived. Unfortunately, only the 1864-1869 data can be found.","A. Knight, in Wheatley (1881), Journal of the Straits Branch of the Royal Asiatic Society",,,,
1864,"Raffles Lighthouse, Coney Islet",1.3302778,104.39930080000001,"J.W. Flory, 2nd Keeper ",,"As we can see during the 1870s, most of the weather records were made by local agriculturalists and landowners. The only official observations we know of were made at Singapore's Raffles and Horsburgh lighthouses during 1864 to 1867 by Thomas Todd (senior keeper) and J. W. Flory (second keeper) respectively (e.g. Todd, 1864). This series was short but far more detailed than those made by the amateur weather-watchers. Their bbservations included pressure, temperature, wind and rainfall and were made 3 times daily at sunrise, noon and sunset. ",,,,,
1864,Horsburgh Lighthouse,1.3302778,104.39930080000001,"Thomas Todd, Senior Keeper",,"Horsburgh was the first lighthouse to be built through British funding in Singapore. Opened in 1850, it was named after Captain James Horsburgh, a hydrographer to the EEIC from 1810 to 1836.
The Raffles lighthouse opened four years after Horsburgh and is still in operation today. 
<br/>
The lighthouse records were originally published in the Government Gazette however, they ceased to be published after 1867 although they were most likely still made. We do not know where these original records are today. ",,,,,
1869,,,,,,,,"In 1869, meteorology for the Straits Settlements was brought under the control of the Medical Department for historic and practical reasons. Firstly, the interest in medical meteorology, a field of medical research that based its investigations on connections between health and weather, grew in the 19th century. As the century progressed, a quantitative method of comparing diseases incidence with meteorological data became common across the colonies of the British Empire (e.g. Walker, 1876, 1925). Secondly, the medical department also offered a coherent infrastructure for the systematic collation of observations within a controlled environment.

The annual average from the Government Gazette is for the whole of Singapore.",,,
1869,"Convict Jail, Bras Basah",1.296972,103.849806 ,"H.L. Randall, Colonial Surgeon (and A.F. Anderson, Acting Pricinpal Civil Medical Officer Aug 1827 - Jun 1873)",Temperature recorded was 26.97°C for the whole of Singapore.,"The first official set of observations under the medical department were made in Singapore at the Convict Jail (Bras Basah) Hospital between 1869 and 1874. This hospital was originally intended to hold transported prisoners (mainly of Indian origin) from other British colonies. The weather data is very detailed and standardised, observations made 3 times a day. 
<br/>
Despite the detailed records, little in known about the small-scale observatory or who made the records. The prison itself was designed and established by George Coleman, Superintendent of Public Works and of Convicts. There was an open plan area with numerous workshops and studio, one of which was presumably an observatory space (McNair & Bayliss, 1889). 
<br/>
Coleman handed operations to his successor, Major John Fedrick McNair, also a prominent architect and engineer. McNair may have supervised a subordinate or even a trusted prisoner to make the observations but they were ultimately signed off by the Colonial Surgeon, H.L. Randall. 
In 1867, the practice of transporting prisoners ended and six years later, so did the observations from this hospital.","<a href=""https://www.dropbox.com/sh/q6qzwclwvy30dkg/AACtvLyJn7IgIZmv5BZ3Pqr7a/Singapore%201869-1874%20Convict%20Hospital?dl=0&preview=Singapore+1869-1876+digit.xlsx&subfolder_nav_tracking=1"">Principal Civil Medical Officer (P.C.M.O) of
the Medical Department, Government Gazette and The Straits Times</a>
<br/>
Wheatley, J. J. L. (1881). Notes on the rainfall of Singapore. Journal of the Straits Branch of the Royal Asiatic Society, (7), 31-50.",,,,
1869,Mount Pleasant,1.3309800000000001,103.838948,"Arthur Knight, Audit Officer",Temperature recorded was 26.97°C for the whole of Singapore.,"The newly gathered long-term weather data led Principal Chief Medical Officer H.L. Randall to conclude that the amount of rainfall affected the numbers of cases of cholera, arguing that ""to a great extent, the health of Singapore is dependent on its Rainfall"".","A. Knight, in Wheatley (1881), Journal of the Straits Branch of the Royal Asiatic Society

< a href=""http://eresources.nlb.gov.sg/newspapers/Digitised/Page/stoverland18740516-1.1.3"">http://eresources.nlb.gov.sg/newspapers/Digitised/Page/stoverland18740516-1.1.3</a>",,,,
1869,P&O Co's Depot,1.263836,103.821591,,Temperature recorded was 26.97°C for the whole of Singapore.,Peninsula and Oriental Steam Navigation depot,"Principal Civil Medical Officer (P.C.M.O) of
the Medical Department, Government Gazette and The Straits Times",,,,
1869,Perseverance Estate,1.327061,103.89587899999999,,Temperature recorded was 26.97°C for the whole of Singapore.,"The practice of making observations at plantations also continued. Into the early 1870s for example, Alsagoff and Company, who owned lemongrass plantations in Peserverance Estate (now Geylang area), made records for rainfall that were published in the Straits Settlements Government Gazette, 1875). The family run business was headed by Syed Osmar bin Mohamed Alsagoff who was a leading member of the local Muslim community and one of the largest plantation owners in Singapore (Tan, 2009).","Principal Civil Medical Officer (P.C.M.O) of
the Medical Department, Government Gazette and The Straits Times",,,,
1869,Goodwood Estate,1.311836,103.834408,,Temperature recorded was 26.97°C for the whole of Singapore.,,"Principal Civil Medical Officer (P.C.M.O) of
the Medical Department, Government Gazette and The Straits Times",,,,
1869,Pauper's Hospital (TTSH),1.3170820000000001,103.858357,,Temperature recorded was 26.97°C for the whole of Singapore.,,"Principal Civil Medical Officer (P.C.M.O) of
the Medical Department, Government Gazette and The Straits Times",,,,
1869,Kandang Kerbau Hospital (KKH),1.30664,103.84942700000001,"H.L. Randall, Principal Civil Medical Officer (up to 1876)",Temperature recorded was 26.97°C for the whole of Singapore.,"After the Convict Jail was closed down, Kandang Kerbau Hospital took over the meteorological role, making observations in a dedicated observatory. KKH grew to become the largest medical facility in Singapore (Lee, 1990). The dataset is very detailed and standardised. Although we do not know exactly who made the observations, there were references made to the Assistant Surgeons and apothcaries working at the hospital undertaking the role (e.g. Government Gazette, 1892). ","Principal Civil Medical Officer (P.C.M.O) of
the Medical Department, Government Gazette and The Straits Times",,,,
1869,General Hospital (Sepoy Lines),1.278972,103.83408300000001,,Temperature recorded was 26.97°C for the whole of Singapore.,,"Principal Civil Medical Officer (P.C.M.O) of
the Medical Department, Government Gazette and The Straits Times",,,,
1878,,,,,,,,"Under the medical department, the number of observation stations across Singapore grew in this period. This expansion had much to do with the enthusiasm of Principal Chief Medical Officer T. Irvine Rowell, who served as PCMO from 1877. His interest in meteorology spanned beyond the practice of medicine. He studied how patterns of settlement might have impacted local weather, especially the purported connection between deforestation and rainfall, as he was interested in understanding anthropogenic changes in climate. Under him, the number of weather stations would rise to around 29  including one at the General Hospital, Sepoy Lines and Waterworks Reservoir (MacRitchie Reservoir).",,,
1878,MacRitchie Reservoir,1.3416999999999999,103.8338,Municipal Engineer,,"MacRitchie reservoir opened at the very end of 1877 and rainfall records were made there from the following year. This dataset comprises one of Singapore's longest, as records are still kept there today. The only gap was during the Second World War.","MacRitchie Reservoir Monthly Rainfall, 1879 - 1948",,,,
1880,"Convict Jail, Bras Basah",1.296972,103.849806 ,"H.L. Randall, Colonial Surgeon (and A.F. Anderson, Acting Pricinpal Civil Medical Officer Aug 1827 - Jun 1873)",Temperature recorded was 27.2°C for the whole of Singapore.,,"Principal Civil Medical Officer (P.C.M.O) of
the Medical Department, Government Gazette and The Straits Times",,,,
1880,Mount Pleasant,1.3309800000000001,103.838948,"Arthur Knight, Audit Officer",Temperature recorded was 27.2°C for the whole of Singapore.,,"A. Knight, in Wheatley (1881), Journal of the Straits Branch of the Royal Asiatic Society",,,,
1880,P&O Co's Depot,1.263836,103.821591,,Temperature recorded was 27.2°C for the whole of Singapore.,,"Principal Civil Medical Officer (P.C.M.O) of
the Medical Department, Government Gazette and The Straits Times",,,,
1880,Goodwood Estate,1.327061,103.89587899999999,,Temperature recorded was 27.2°C for the whole of Singapore.,,"Principal Civil Medical Officer (P.C.M.O) of
the Medical Department, Government Gazette and The Straits Times",,,,
1880,Perseverance Estate,1.311836,103.834408,,Temperature recorded was 27.2°C for the whole of Singapore.,,"Principal Civil Medical Officer (P.C.M.O) of
the Medical Department, Government Gazette and The Straits Times",,,,
1880,Pauper's Hospital (TTSH),1.3170820000000001,103.858357,,Temperature recorded was 27.2°C for the whole of Singapore.,,"Principal Civil Medical Officer (P.C.M.O) of
the Medical Department, Government Gazette and The Straits Times",,,,
1880,Kandang Kerbau Hospital (KKH),1.30664,103.84942700000001,"T. Irvine Rowell, Principal Civil Midical Officer (from 1877 to 1886)
Max F. Simon (from 1887 to 1889)",Temperature recorded was 27.2°C for the whole of Singapore.,,"Principal Civil Medical Officer (P.C.M.O) of
the Medical Department, Government Gazette and The Straits Times",,,,
1880,General Hospital (Sepoy Lines),1.278972,103.83408300000001,,Temperature recorded was 27.2°C for the whole of Singapore.,,"Principal Civil Medical Officer (P.C.M.O) of
the Medical Department, Government Gazette and The Straits Times",,,,
1890,,,,,,,,"During the 1890s, there seems to have been a decrease in the number of weather stations. This may be due to records being lost. These two locations we found only provided rainfall data but none for temperatures.",,,
1890,MacRitchie Reservoir,1.3416999999999999,103.8338,Municipal Engineer,,,"MacRitchie Reservoir Monthly Rainfall, 1879 - 1948",,,,
1890,Kandang Kerbau Hospital (KKH),1.30664,103.84942700000001,"H.S. Colston, Acting Colonial Surgeon (1889)
T.S. Kerr, Colonial Surgeon (1893 - ?)",,,,,,,
1920,Mount Faber Observatory,1.2688889999999999,103.82333300000001,,Temperature recorded was 28.3°C for the whole of Singapore.,"In September 1903, it was suggested by R. S. Fry, who ran a small observatory with a timeball for ships on Pulau Brani, that the facility ought to be moved to Mount Faber because the accuracy of the clock was being impaired by nearby reclamation works. His advice was taken  and the observatory on Mount Faber began operation on 1 June 1905.
<br/>
In 1929, the Faber Observatory was expanded to become the first full-scale observation station in Singapore. Singapore was also made the headquarters of the Malayan Meteorological Service with its offices located in the Fullerton Building (now hotel).","Makepeace, W., Brooke, G. E., & Braddell, R. St. J. (Eds.). (1991). One hundred years of Singapore (Vol. 1). Singapore: Oxford University Press, p. 481. (Call no.: RSING 959.57 ONE-[HIS]); Ng, M. F. C. (2012). A ride to remember: The story of Mount Faber and Singapore Cable Car. Singapore: Mount Faber Leisure Group, p. 12. Available via PublicationSG.",,,,
1920,Singapore Botanic Gardens,1.3100000000000001,103.81699999999999,Director of Botanic Gardens,Temperature recorded was 28.3°C for the whole of Singapore.,Rainfall readings at the Botanic Gardens were made at the Director's house at 8am every day from 1916-1924.,"<a href=""https://lkcnhm.nus.edu.sg/dna/docs/0314f6d7a300fbd675f866c965f9916c.pdf"">https://lkcnhm.nus.edu.sg/dna/docs/0314f6d7a300fbd675f866c965f9916c.pdf</a>",,,,
1920,St John's Island,1.217247,103.848798,Medical Officer,,Readings most likely taken at the Medical Officer's quarters.,,,,,
1934,,,,,,,,"In 1934, the Mount Faber station as well as the headquarters at the Fullerton Building were moved to Kallang Airport, which the authorities thought was a more suitable location for observing Singapore’s weather and for the transmission of weather information to aircraft.",,,
1934,Kallang Airfield,,,,26.2°C,,"Survey Department. (1932). Survey Department, Straits Settlements. In Annual Departmental Reports of the Straits Settlements for the year 1931 (p. 18). Singapore: Government Printing Press. (Call no.: RRARE 325.3410959 SSADRS; Microfilm no.: NL2921)",,,,,
1940,,,,,,,,"The Kandang Kerbau observations were not published in the government gazettes beyond 1917 although they continued to be made. A possible explanation for their public disappearance was that the meteorology was moved out of the Medical Department and into the Museum Department under Herbert Robinson.
After this, all meteorological returns for the peninsula were collated by specialist clerks in the employ of the Museum’s Department (SEL: SEC 1108/1925). This was the preamble to the establishment of a formal, dedicated Malayan Meteorological Department in 1929 (Maxwell & Robinson, 1927)",,,,
1940,MacRitchie Reservoir,1.3416999999999999,103.8338,PUB,Temperature recorded was 27.0°C for the whole of Singapore.,,"MacRitchie Reservoir Monthly Rainfall, 1879 - 1948",,,,,
1940,Museum Department (?),,,,Temperature recorded was 27.0°C for the whole of Singapore.,,,,,,,
1980,,,,,,,,"Before Singapore gained independence in 1965, weather records were kept by the Malayan Meteorological Services. Their main observation station was in Paya Lebar and they had 30 auxiliary stations, some in Singapore (such as Tengah, Seletar, Mandai and Jurong East) and others in Malaya. After 1965, the Meteorological Service Singapore (MSS) was formed. In 1970, the storm warning radar at Paya Lebar was replaced with one that could track and locate storms up to 400km away. This provided the airport with more accurate details for aircraft landing (The Straits Times, 14 December 1965; The Straits Times, 17 April 1970).",,,,
1980,MacRitchie Reservoir,1.3416999999999999,103.8338,PUB and MSS,Temperature recorded was 26.9°C for the whole of Singapore.,,,,,,,
1980,Paya Lebar,1.3524,103.9007,,Temperature recorded was 26.9°C for the whole of Singapore.,"The weather station at Paya Lebar Airport was built in the late 1950s. 
<br/>
A photograph of Yang di-Pertuan Negara Yusof Ishak peering into a weather apparatus at Paya Lebar Airport can be found in the Yusof Ishak Collection, in courtesy of National Archives of Singapore (https://biblioasia.nlb.gov.sg/vol-16/issue-2/jul-sep-2020/rain#fnref:10)
","<a href=""https://biblioasia.nlb.gov.sg/vol-16/issue-2/jul-sep-2020/rain#fnref:10"">https://biblioasia.nlb.gov.sg/vol-16/issue-2/jul-sep-2020/rain#fnref:10</a>",,,,,
1990,,,,,,,,"In the 1990s, there were 25 weather stations in Singapore, though only a handful provided temperature data. Perhaps due to the large number of floods happening in Singapore post-independence, the focus became to monitor rainfall levels. It is not clear if temperature observations were made and lost,  not made at all, or whether all  records were merged into other kinds of data.",,,,
1990,Seletar,1.4166000000000001,103.86539999999999,,27.4°C,,,,,,,
1990,Changi,1.3677999999999999,103.98260000000001,,27.6°C,,,,,,,
2000,,,,,,,,"In the 2000s, the number of weather stations keeping records of temperature increased. These records mainly consist of the daily maximum and minimum temperature as well as the daily average. 
<br/>
The image shows an  isotherm map for the year 2000  produced using the average temperature data of the weather stations. An isotherm map gives a visual representation of the distribution of the surface temperature across a defined location. The more data points acquired, the more accurate the  map will be.
<br/>
From the isotherm map we can see that in 2000, the eastern region of Singapore was warmer than the west. This could be attributed to rapid development of this region, and downtown, producing an Urban Heat Island (UHI) effect  (Concept Plan, 1991).",,,,
2000,Tengah,1.3857999999999999,103.7114,,26.8°C,,,,,,,
2000,Seletar,1.4166000000000001,103.86539999999999,,27.2°C,,,,,,,
2000,Changi,1.3677999999999999,103.98260000000001,,27.5°C,,,,,,,
2000,Sembawang,1.4252,103.8202,,27°C,,,,,,,
2005,Tengah,1.3857999999999999,103.7114,,27.3°C,,,,,,,
2005,Seletar,1.4166000000000001,103.86539999999999,,27.7°C,,,,,,,
2005,Changi,1.3677999999999999,103.98260000000001,,28°C,,,,,,,
2005,Sembawang,1.4252,103.8202,,27.4°C,,,,,,,
2010,,,,,,,,"By 2010, there are 58 weather stations in Singapore. Only those that recorded temperature data are shown in this map. We can observe a general increase in the surface temperature across Singapore since 2000, regardless of the region. Population increased from 4.02 million to 5.07 million in just 10 years (2000-2010). More infrastructure such as transport and buildings (for housing and business) was also in place. Following the 2001 Concept Plan, the urban center in downtown was decentralised to the western region, and new buildings were still being built in mature estates such as Queenstown and Redhill but with more density and at greater heights (URA, 2001). Development partly  resulted in higher temperatures being recorded in the east, west and north regions of Singapore due to the UHI effect.
<br/>
The 2001 Concept Plan also draw a focus to greening Singapore. Green spaces such as the Central Catchment Area were left untouched and there were plans to increase Singapore's green spaces from 2,500 ha to 4,500 ha. As such we can see a region of cooler surface temperature in Singapore's central region.
  ",,,,
2010,MacRitchie Reservoir,1.3416999999999999,103.8338,PUB and MSS,No temperature data.,,,,,,,
2010,Seletar,1.4166000000000001,103.86539999999999,,28°C,,,,,,,
2010,Jurong West,1.3454999999999999,103.6806,,27.3°C,,,,,,,
2010,Sentosa,1.25,103.8279,,28.2°C,,,,,,,
2010,Changi,1.3677999999999999,103.98260000000001,,28.1°C,,,,,,,
2010,Ang Mo Kio,1.3764000000000001,103.8492,,27.7°C,,,,,,,
2010,Admiralty,1.4439,103.7854,,27.7°C,,,,,,,
2010,Boon Lay East,1.3302,103.7205,,28.4°C,,,,,,,
2010,Pulau Semakau,1.1890000000000001,103.768,,28.3°C,,,,,,,
2010,Pulau Ubin,1.4168000000000001,103.96729999999999,,27.5°C,,,,,,,
2010,East Coast Parkway,1.3133999999999999,103.9619,,28.1°C,,,,,,,
2010,Newton,1.3106,103.8365,,27.5°C,,,,,,,
2010,Upper Pierce Reservoir,1.3700000000000001,103.80500000000001,,"Weather station only started operating in February 2010. There was no temperature data, only rainfall data.",,,,,,,
2010,Toa Payoh,1.3414999999999999,103.8519,,"Weather station only started operating in March 2010. There was no temperature data, only rainfall data",,,,,,,
2015,,,,,,,,"Despite measures to increase green spaces, the rate of urban development outweighed the cooling effect made by greening Singapore. The Central Business District (CBD) of Singapore in the southeastern region, Jurong (western region) and Jurong Islands (Singapore's offshore island in the west) reflected areas of higher temperature compared to the rest of the city. Decentralising the urban centre from the CBD area to Jurong may have helped reduce temperature increase in the southeast region of Singapore, but led to pockets of higher heat in the west. Jurong Island, being a heavily industrialised area, was not spared the experience of higher heat despite being surrounded by water.",,,,
2015,Tengah,1.3857999999999999,103.7114,,27.7°C,,,,,,,
2015,Seletar,1.4166000000000001,103.86539999999999,,28.4°C,,,,,,,
2015,Tai Seng,1.3399000000000001,103.8878,,28.6°C,,,,,,,
2015,Jurong West,1.3454999999999999,103.6806,,27.6°C,,,,,,,
2015,Clementi,1.3337000000000001,103.77679999999999,,27.7°C,,,,,,,
2015,Sentosa,1.25,103.8279,,28.2°C,,,,,,,
2015,Changi,1.3677999999999999,103.98260000000001,,28.2°C,,,,,,,
2015,Sembawang,1.4252,103.8202,,27.7°C,,,,,,,
2015,Ang Mo Kio,1.3764000000000001,103.8492,,28°C,,,,,,,
2015,Admiralty,1.4439,103.7854,,27.9°C,,,,,,,
2015,Boon Lay East,1.3302,103.7205,,28.4°C,,,,,,,
2015,Pulau Semakau,1.1890000000000001,103.768,,28.2°C,,,,,,,
2015,Pulau Ubin,1.4168000000000001,103.96729999999999,,27.5°C,,,,,,,
2015,East Coast Parkway,1.3133999999999999,103.9619,,28.2°C,,,,,,,
2015,Newton,1.3106,103.8365,,27.9°C,,,,,,,
2015,Marina Barrage,1.2799,103.8703,,28.7°C,,,,,,,
2015,Pasir Panjang,1.2809999999999999,103.754,,28.5°C,,,,,,,
2015,Khatib,1.4173,103.8249,,27.8°C,,,,,,,
